{
  "$schema": "../../schemas/repository_profile.schema.json",
  "schema_version": "1.1.0",
  "repository": "grandchallenge/MATHFORGE",
  "profile": "forge",
  "constitutional_role": "Exploration, source reconstruction, candidate generation, and reconnaissance.",
  "authority_scope": "Candidate problem cards and reproducible reconnaissance; never mathematical certification.",
  "claim_promotion_role": "candidate_only",
  "risk_tier": "high",
  "required_workflow_profile": "forge-reconnaissance",
  "constitutional_source": {
    "repository": "grandchallenge/INTELLECT",
    "path": "CONSTITUTION.md",
    "effective_version": "1.0.0"
  },
  "operating_policy_source": {
    "repository": "grandchallenge/gcl-standards",
    "path": "standards/GCL-GHOS-00.md",
    "version": "0.1.0",
    "status": "candidate"
  },
  "public_interfaces": ["issues", "pull_requests", "releases", "packages"],
  "release_policy": "prerelease"
}
