{
  "$schema": "../../schemas/repository_profile.schema.json",
  "schema_version": "1.1.0",
  "repository": "grandchallenge/MATH-PROGRAMME",
  "profile": "programme",
  "constitutional_role": "Mathematics governance, integration, publication, and archival authority.",
  "authority_scope": "Mathematics-specific standards, schemas, domain registry, roadmap, and admitted public documentation.",
  "claim_promotion_role": "policy_only",
  "risk_tier": "critical",
  "required_workflow_profile": "programme-policy",
  "constitutional_source": {
    "repository": "grandchallenge/INTELLECT",
    "path": "CONSTITUTION.md",
    "effective_version": "1.0.0"
  },
  "operating_policy_source": {
    "repository": "grandchallenge/gcl-standards",
    "path": "standards/GCL-GHOS-00.md",
    "version": "0.1.0",
    "status": "candidate"
  },
  "public_interfaces": ["issues", "pull_requests", "pages", "releases"],
  "release_policy": "immutable_admitted"
}
