{
  "$schema": "../../schemas/repository_profile.schema.json",
  "schema_version": "1.1.0",
  "repository": "grandchallenge/upload-pages-artifact",
  "profile": "provider",
  "constitutional_role": "Organization-owned, immutable action provider for packaging the validated Pages artifact.",
  "authority_scope": "Pinned supply-chain implementation for governed Pages publication; no constitutional, programme, or mathematical claim authority.",
  "claim_promotion_role": "none",
  "risk_tier": "critical",
  "required_workflow_profile": "provider-action-supply-chain",
  "constitutional_source": {
    "repository": "grandchallenge/INTELLECT",
    "path": "CONSTITUTION.md",
    "effective_version": "1.0.0"
  },
  "operating_policy_source": {
    "repository": "grandchallenge/gcl-standards",
    "path": "standards/GCL-GHOS-00.md",
    "version": "0.1.0",
    "status": "candidate"
  },
  "public_interfaces": ["pull_requests", "releases"],
  "release_policy": "immutable_admitted"
}
